{"$schema":"https://json-schema.org/draft/2020-12/schema","$id":"https://thedailyline.bet/schemas/video/v1/asset-plan.schema.json","title":"AssetPlan","type":"object","additionalProperties":false,"required":["schema_version","asset_plan_id","creative_variant_id","slots","provider_policy_ref","budget_policy_ref","asset_plan_digest"],"properties":{"schema_version":{"const":"asset-plan.v1"},"asset_plan_id":{"$ref":"common.schema.json#/$defs/Id"},"creative_variant_id":{"$ref":"common.schema.json#/$defs/Ref"},"slots":{"type":"array","items":{"$ref":"#/$defs/AssetSlot"}},"provider_policy_ref":{"$ref":"common.schema.json#/$defs/Ref"},"budget_policy_ref":{"$ref":"common.schema.json#/$defs/Ref"},"asset_plan_digest":{"$ref":"common.schema.json#/$defs/Digest"}},"$defs":{"AssetSlot":{"type":"object","additionalProperties":false,"required":["slot_id","scene_id","asset_role","allowed_source_classes","query_or_prompt_intent","subject_policy","aspect_ratio","resolution_floor","reuse_allowed","fallback_chain"],"properties":{"slot_id":{"$ref":"common.schema.json#/$defs/Id"},"scene_id":{"$ref":"common.schema.json#/$defs/Ref"},"asset_role":{"type":"string","minLength":1},"allowed_source_classes":{"type":"array","items":{"enum":["owned","licensed","generated","stock","public_domain","platform_supplied","data_visualization"]},"uniqueItems":true},"query_or_prompt_intent":{"type":"string","minLength":1},"subject_policy":{"$ref":"common.schema.json#/$defs/Ref"},"aspect_ratio":{"type":"string","pattern":"^[1-9][0-9]*:[1-9][0-9]*$"},"resolution_floor":{"type":"object","additionalProperties":false,"required":["width","height"],"properties":{"width":{"type":"integer","minimum":1},"height":{"type":"integer","minimum":1}}},"reuse_allowed":{"type":"boolean"},"fallback_chain":{"$ref":"common.schema.json#/$defs/StringSet"}}}}}
