{"schema_version":"asset-plan.v1","asset_plan_id":"assetplan.mlb.sf-lad.1a","creative_variant_id":"creative.mlb.sf-lad.20260908.1a","slots":[{"slot_id":"asset.hero","scene_id":"scene.hook","asset_role":"hero_background","allowed_source_classes":["generated","owned","stock"],"query_or_prompt_intent":"generic professional baseball stadium at night, no identifiable marks or people","subject_policy":"generic-sports-no-likeness.v1","aspect_ratio":"9:16","resolution_floor":{"width":1080,"height":1920},"reuse_allowed":true,"fallback_chain":["data_visualization","owned"]},{"slot_id":"asset.data-bg","scene_id":"scene.reason","asset_role":"data_background","allowed_source_classes":["owned","data_visualization"],"query_or_prompt_intent":"Daily Line branded data grid","subject_policy":"brand-owned.v1","aspect_ratio":"9:16","resolution_floor":{"width":1080,"height":1920},"reuse_allowed":true,"fallback_chain":["owned"]}],"provider_policy_ref":"asset-provider-order.v1","budget_policy_ref":"video-cost-budget.v1","asset_plan_digest":"sha256:4b97e3185437e0c1264361929964cf255cc2a7f47dd084a261811d8818c6a8bf"}
